source,title,description,url,publishedAt,published_at
"{'id': None, 'name': 'CNBC'}",Stock futures are little changed after Thursday’s sell-off on Wall Street: Live updates - CNBC,Thursday's retreat from recent highs sharply narrowed the S&P 500's weekly gain.,https://www.cnbc.com/2025/02/20/stock-market-today-live-updates.html,2025-02-21T00:22:00Z,
"{'id': None, 'name': 'BBC News'}","Body returned from Gaza is not Bibas mother, Israeli military says - BBC.com","The Israeli military says a body returned by Hamas is not hostage Shiri Bibas, as claimed by Hamas.",https://www.bbc.com/news/articles/cjry3jzedl1o,2025-02-21T00:02:03Z,
"{'id': None, 'name': 'WESH Orlando'}",IRS employees in Florida speak out after sudden terminations - WESH 2 Orlando,"In Florida, we've confirmed with a union president that probationary employees are being terminated.",https://www.wesh.com/article/irs-employees-terminations-florida/63857515,2025-02-21T00:00:00Z,
"{'id': 'cnn', 'name': 'CNN'}","Hegseth could fire some senior generals and admirals soon, sources say - CNN","Secretary of Defense Pete Hegseth could soon move to fire more than half a dozen generals and flag officers, according to two sources familiar with the matter, part of an effort to purge the department of senior leaders perceived as either too political or to…",https://www.cnn.com/2025/02/20/politics/hegseth-could-fire-senior-generals-admirals/index.html,2025-02-20T23:44:00Z,
"{'id': 'cnn', 'name': 'CNN'}","Delta Air Lines offers $30,000 for each passenger on the flight that crashed in Toronto - CNN","Delta Air Lines is offering passengers who were on the flight that crashed and overturned at Toronto Pearson International Airport $30,000 each.",https://www.cnn.com/2025/02/20/business/delta-toronto-crash-payout-offer/index.html,2025-02-20T23:38:00Z,
"{'id': 'abc-news', 'name': 'ABC News'}",3 buses explode in suspected terror attack near Tel Aviv: Israeli police - ABC News,,https://abcnews.go.com/International/israeli-police-responding-reports-explosions-buses-tel-aviv/story?id\\u003d119016099,2025-02-20T23:07:37Z,
"{'id': None, 'name': 'Hollywood Reporter'}",Daniel Craig Responds to Amazon MGM Taking Control of James Bond Franchise - Hollywood Reporter,The studio will form a new joint venture with producers Michael G. Wilson and Barbara Broccoli to house the series' intellectual property rights.,http://www.hollywoodreporter.com/movies/movie-news/james-bond-daniel-craig-amazon-mgm-1236142286/,2025-02-20T22:57:38Z,
"{'id': None, 'name': 'AL.com'}",All Hanceville police officers placed on leave as Cullman sheriff takes over patrols - AL.com,"Beginning at 5 p.m., deputies answer all law enforcement calls in the city of roughly 3,300 people.",https://www.al.com/crime/2025/02/all-hanceville-police-officers-placed-on-leave-as-cullman-sheriff-takes-over-patrols.html,2025-02-20T22:36:00Z,
"{'id': None, 'name': 'NBCSports.com'}",Zack Martin has told the Cowboys he plans to retire - NBC Sports,The seven-time first-team All-Pro has decided to call it a career at age 34.,https://www.nbcsports.com/nfl/profootballtalk/rumor-mill/news/zack-martin-has-told-the-cowboys-he-plans-to-retire,2025-02-20T22:27:26Z,
"{'id': 'the-washington-post', 'name': 'The Washington Post'}",Odds of recently discovered asteroid hitting Earth drop nearly to zero - The Washington Post,Another night of observations revealed there is little to fear from the football-field-sized Asteroid 2024 YR4.,https://www.washingtonpost.com/science/2025/02/20/asteroid-2024-yr4-odds-hitting-earth-near-zero/,2025-02-20T22:08:34Z,
"{'id': 'associated-press', 'name': 'Associated Press'}",Trump administration throws out protections from deportation for roughly half a million Haitians - The Associated Press,The Trump administration is throwing out protections for roughly half a million Haitians that had shielded them from deportation. The decision announced Thursday means they would lose their work permits and could be eligible to be removed from the country by …,https://apnews.com/article/haiti-trump-homeland-security-temporary-status-immigration-8fafbf744d0cdbeffb58be73fb0a8879,2025-02-20T21:29:00Z,
"{'id': None, 'name': 'SpaceNews'}",Musk calls for deorbiting ISS “as soon as possible” - SpaceNews,"SpaceX Chief Executive Elon Musk said that NASA should deorbit the International Space Station “as soon as possible,” preferably in the next two years.",http://spacenews.com/musk-calls-for-deorbiting-iss-as-soon-as-possible/,2025-02-20T21:26:32Z,
"{'id': 'associated-press', 'name': 'Associated Press'}","Victor Wembanyama expected to miss remainder of season after blood clot diagnosis, Spurs announce - The Associated Press","San Antonio star Victor Wembanyama is expected to miss the remainder of the regular season after being diagnosed with a blood clot in his right shoulder, the Spurs announced Thursday. It is a massive blow to the Spurs, who are contending for a playoff spot in…",https://apnews.com/article/victor-wembanyama-spurs-blood-clots-4f4a563b7217373e2b5fac0afaececa0,2025-02-20T20:48:00Z,
"{'id': 'bloomberg', 'name': 'Bloomberg'}","Bird Flu Kills Dairy Workers’ Cats, Suggesting a Viral Change - Bloomberg","Two house cats died after contracting bird flu in the homes of dairy workers, a troubling sign that the virus may be moving between species and becoming more widespread.",https://www.bloomberg.com/news/articles/2025-02-20/bird-flu-kills-dairy-workers-cats-suggesting-a-viral-change,2025-02-20T20:47:21Z,
"{'id': 'politico', 'name': 'Politico'}",Senate stares down an all-nighter to approve a ‘Plan B’ budget Trump spurned - POLITICO,"The Senate could be voting on amendments to a nonbinding, but highly consequential, budget resolution well into the early morning hours.",https://www.politico.com/live-updates/2025/02/20/congress/senate-vote-a-rama-budget-begins-00205258,2025-02-20T20:11:09Z,
"{'id': 'techcrunch', 'name': 'TechCrunch'}",Exclusive: Stalkerware apps Cocospy and Spyic are exposing phone data of millions of people - TechCrunch,A bug in the Android and iPhone monitoring operations allows anyone to access private data exfiltrated from a victim's device.,https://techcrunch.com/2025/02/20/stalkerware-apps-cocospy-spyic-exposing-phone-data-of-millions-of-people/,2025-02-20T20:05:00Z,
"{'id': 'abc-news', 'name': 'ABC News'}",Kash Patel confirmed by Senate to be Trump's FBI director - ABC News,,https://abcnews.go.com/Politics/senate-vote-kash-patels-nomination-lead-fbi/story?id\\u003d118929545,2025-02-20T19:30:00Z,
"{'id': 'fox-news', 'name': 'Fox News'}","Fearing Trump will cross border militarily to pursue cartels, Mexico moves to reform constitution - Fox News",Mexico President Claudia Sheinbaum said she will propose constitutional reforms aimed at protecting the country’s sovereignty over concerns that the U.S. military could pursue drug cartels inside Mexico.,https://www.foxnews.com/world/fearing-trump-cross-border-militarily-pursue-cartels-mexico-moves-reform-constitution,2025-02-20T18:56:00Z,
"{'id': None, 'name': 'Variety'}",Blake Lively’s Publicist Says She Didn’t Defame Justin Baldoni When She Wrote ‘The Whole Cast Hates Him’ - Variety,"Blake Lively's publicist, Leslie Sloane, argued it was not defamatory to say that the whole cast of ""It Ends With Us"" hated director Justin Baldoni.",https://variety.com/2025/film/news/blake-lively-justin-baldoni-cast-hates-him-defamation-lawsuit-1236314273/,2025-02-20T18:51:00Z,
winklertimes,US offers UN resolution on war in Ukraine that stops far short of competing European statement,"UNITED NATIONS (AP) &#8212; The United States has proposed a draft U.N. resolution that stops far short of a competing European-backed statement demanding an immediate withdrawal of all of Moscow&#8217;s forces from Ukraine. Both are timed to the third anniversary of Russia&#8217;s invasion of Ukraine, which falls on Monday, when the U.N. General Assembly will [&#8230;]",https://winnipegsun.com/pmn/us-offers-un-resolution-on-war-in-ukraine-that-stops-far-short-of-competing-european-statement,,2025-02-22T01:31:49+00:00
lulegacy,Advance Auto Parts (NYSE:AAP) Trading Down 4.8% - Should You Sell?,Advance Auto Parts (NYSE:AAP) Shares Down 4.8% - Here's Why,https://www.marketbeat.com/instant-alerts/advance-auto-parts-nyseaap-trading-down-48-whats-next-2025-02-20/,,2025-02-22T01:31:39+00:00
lulegacy,Moderna (NASDAQ:MRNA) Trading 8.8% Higher - What's Next?,Moderna (NASDAQ:MRNA) Trading Up 8.8% - What's Next?,https://www.marketbeat.com/instant-alerts/moderna-nasdaqmrna-stock-price-up-88-still-a-buy-2025-02-20/,,2025-02-22T01:31:26+00:00
lulegacy,Ferrexpo (LON:FXPO) Shares Down 30.4% - Time to Sell?,Ferrexpo (LON:FXPO) Stock Price Down 30.4% - Here's Why,https://www.marketbeat.com/instant-alerts/ferrexpo-lonfxpo-shares-down-304-time-to-sell-2025-02-20/,,2025-02-22T01:31:19+00:00
wishtv,"Judge largely blocks Trump’s orders on diversity, equity and inclusion","A federal judge has granted a preliminary injunction blocking President Trump's executive orders that aimed to end government support for diversity, equity, and inclusion programs. A lawsuit called the order a constitutional violation with a chilling effect on free speech.",https://www.wishtv.com/news/politics/trump-blocked-dei-executive-orders/,,2025-02-22T01:31:18+00:00
lulegacy,Ceres Power (LON:CWR) Trading Down 38.5% - Here's What Happened,Ceres Power (LON:CWR) Shares Down 38.5% - Here's Why,https://www.marketbeat.com/instant-alerts/ceres-power-loncwr-trading-down-385-heres-what-happened-2025-02-20/,,2025-02-22T01:31:17+00:00
lulegacy,Ithaca Energy (LON:ITH) Trading 9.3% Higher - What's Next?,Ithaca Energy (LON:ITH) Trading 9.3% Higher - Here's What Happened,https://www.marketbeat.com/instant-alerts/ithaca-energy-lonith-trading-93-higher-whats-next-2025-02-20/,,2025-02-22T01:31:14+00:00
santacruzsentinel,Commentary | Amy Goodman & Denis Moynihan: Dark shadows of fascism over Germany and the US,"By Amy Goodman & Denis Moynihan “Nothing is more dishonorable for a civilized people than to let itself be ‘governed’ without resistance by an irresponsible clique of rulers devoted to dark instincts.” These words open the first communiqué of the White Rose, a collective of young Germans in Munich, including brother and sister Hans and [&#8230;]",https://www.santacruzsentinel.com/2025/02/21/commentary-amy-goodman-denis-moynihan-dark-shadows-of-fascism-over-germany-and-the-us/,,2025-02-22T01:31:05+00:00
awfulannouncing,Baltimore reporters argue on X over coverage of Justin Tucker allegations,"A pair of Baltimore reporters, Justin Fenton of The Baltimore Banner and Brian Wacker of The Baltimore Sun are at odds over the reporting of the sexual misconduct allegations leveled against Baltimore Ravens kicker Justin Tucker. Fenton took issue with an article by Wacker, which The Sun shared on its official X (formerly Twitter) account. &#8220;This is intentionally Read more...The post Baltimore reporters argue on X over coverage of Justin Tucker allegations appeared first on Awful Announcing.",https://awfulannouncing.com/newspapers/baltimore-sun-banner-justin-tucker-allegations-reporting.html,,2025-02-22T01:30:15+00:00
Rivals,QB dominoes continue to fall after Jonas Williams flips to USC,The quarterback news continues and was even ramped up even more when Jonas Williams flipped to USC.,https://n.rivals.com/news/qb-dominoes-continue-to-fall-after-jonas-williams-flips-to-usc,,2025-02-22T01:29:28+00:00
Essentially Sports,Lindsey Heaps Left Concerned About USWNT Teammate’s Reaction After Special Surprise at SheBelieves Cup,"Did you notice something different on the back of Lindsey Horan&#8217;s shirt during yesterday&#8217;s SheBelieves Cup game? We’d be surprised if you didn’t, because the USWNT midfielder stepped onto the pitch wearing a different last name alongside her iconic No. 10—Heaps, to be precise. While the gesture was met with both enthusiasm and hesitation from fans, [&#8230;]The post Lindsey Heaps Left Concerned About USWNT Teammate’s Reaction After Special Surprise at SheBelieves Cup appeared first on EssentiallySports.",https://www.essentiallysports.com/us-sports-news-soccer-news-lindsey-heaps-left-concerned-about-uswnt-teammate-reaction-after-special-surprise-at-shebelieves-cup/,,2025-02-22T01:29:23+00:00
dailybulletin,San Bernardino County reverses course in handling of wild burros,The county is currently working on new agreements with the Riverside-based DonkeyLand rescue organization.,https://www.dailybulletin.com/2025/02/21/san-bernardino-county-reverses-course-in-handling-of-wild-burros/,,2025-02-22T01:28:32+00:00
redlandsdailyfacts,San Bernardino County reverses course in handling of wild burros,The county is currently working on new agreements with the Riverside-based DonkeyLand rescue organization.,https://www.redlandsdailyfacts.com/2025/02/21/san-bernardino-county-reverses-course-in-handling-of-wild-burros/,,2025-02-22T01:28:32+00:00
sbsun,San Bernardino County reverses course in handling of wild burros,The county is currently working on new agreements with the Riverside-based DonkeyLand rescue organization.,https://www.sbsun.com/2025/02/21/san-bernardino-county-reverses-course-in-handling-of-wild-burros/,,2025-02-22T01:28:32+00:00
Essentially Sports,Damian Lillard Confirms Mental Toll as Doc Rivers Puts Faith in Bucks Vet After Latest Bobby Portis News,"The Milwaukee Bucks had every reason to crumble. They entered Thursday night&#8217;s matchup against LA Clippers with a cloud hanging over them—Bobby Portis&#8217; suspension. The team’s high-energy sixth man had just been handed a 25-game ban for reportedly violating the league’s drug policy, leaving Milwaukee without a key piece of its rotation. Yet, when it [&#8230;]The post Damian Lillard Confirms Mental Toll as Doc Rivers Puts Faith in Bucks Vet After Latest Bobby Portis News appeared first on EssentiallySports.",https://www.essentiallysports.com/nba-active-basketball-news-damian-lillard-confirms-mental-toll-as-doc-rivers-puts-faith-in-bucks-vet-after-latest-bobby-portis-news/,,2025-02-22T01:28:14+00:00
Essentially Sports,More Doubts Over Carson Beck’s Miami Career as Miami Insider Confirms Injury Status Amid Mario Cristobal Concerns,"Carson Beck, a name whispered with &#8216;what ifs,&#8217; traded Bulldog red for Hurricane orange. NFL dreams? He parked &#8217;em, diving headfirst into Cristobal&#8217;s team, lured by a cool $4 million. After 5 seasons and 2 national championships with Georgia, he aimed to be Miami&#8217;s chosen one, leading them to the promised land in &#8217;25. From [&#8230;]The post More Doubts Over Carson Beck’s Miami Career as Miami Insider Confirms Injury Status Amid Mario Cristobal Concerns appeared first on EssentiallySports.",https://www.essentiallysports.com/ncaa-college-football-news-more-doubts-over-carson-becks-miami-career-as-miami-insider-confirms-injury-status-amid-mario-cristobal-concerns/,,2025-02-22T01:27:59+00:00
santacruzsentinel,"Dan Walters, CalMatters | California’s aging population will test whether its demography is destiny","California is a living laboratory for the observation that demography is destiny, first uttered by the 19th century French philosopher Auguste Comte. During the first 150 years of its statehood, California’s population grew briskly thanks to the effects of immigration from other countries and other states. However, although its ethnic and cultural attributes evolved, there [&#8230;]",https://www.santacruzsentinel.com/2025/02/21/dan-walters-calmatters-californias-aging-population-will-test-whether-its-demography-is-destiny/,,2025-02-22T01:27:30+00:00
latimes,Trump fires chairman of the Joint Chiefs of Staff,President Trump has abruptly fired Air Force Gen. CQ Brown as chairman of the Joint Chiefs of Staff.,https://www.latimes.com/world-nation/story/2025-02-21/trump-fires-chairman-of-the-joint-chiefs-of-staff,,2025-02-22T01:26:07+00:00
Essentially Sports,Jason Kidd Drops Update on Key Player as PJ Washington Finally Set to Return Against Pelicans,"The Dallas Mavericks were in dire straits after they lost all their big men to injury. It left them scrambling to improvise with their already thin roster. However, coach Jason Kidd had some optimistic updates ahead of their New Orleans Pelicans game. Updates concerning the often-injured PJ Washington and a new face in the Mavs [&#8230;]The post Jason Kidd Drops Update on Key Player as PJ Washington Finally Set to Return Against Pelicans appeared first on EssentiallySports.",https://www.essentiallysports.com/nba-active-basketball-news-jason-kidd-drops-update-on-key-player-moses-brown-as-pj-washington-finally-set-to-return-against-new-orleans-pelicans/,,2025-02-22T01:25:57+00:00
upiasia,U.S. Supreme Court prevents top watchdog from being fired for now,The U.S. Supreme Court on Friday handed President Donald Trump at least a temporary loss when the justices declined to hear an emergency appeal to fire the leader of an independent watchdog agency.,https://www.upi.com/Top_News/US/2025/02/21/Supreme-Court-allows-watchdog-keep-jon-at-least-temporarily/7131740182741/,,2025-02-22T01:25:50+00:00
Seeking Alpha,HSBC Holdings plc (HSBC) Q4 2024 Earnings Call Transcript,HSBC Holdings plc (HSBC) Q4 2024 Earnings Call Transcript,https://seekingalpha.com/article/4760868-hsbc-holdings-plc-hsbc-q4-2024-earnings-call-transcript?source=feed_all_articles,,2025-02-22T01:25:47+00:00
denverpost,Rockies see Brenton Doyle bringing power to leadoff spot,Manager Bud Black liked the idea of Doyle providing power at the top of the lineup as Blackmon did.,https://www.denverpost.com/2025/02/21/brenton-doyle-rockies-leadoff-power/,,2025-02-22T01:24:17+00:00
Essentially Sports,"“Unfortunate”- Chase Briscoe Breaks Silence on NASCAR’s $100,000 Shutdown","NASCAR fans, buckle up—Chase Briscoe and Joe Gibbs Racing just got slammed with a $100,000 gut punch, and the drama’s hotter than a summer day at Darlington! The No. 19 team’s been hauled over the coals for tweaking a single-source part—think of it as sneaking an extra turbo under NASCAR’s nose—and the rulebook cops weren’t [&#8230;]The post “Unfortunate”- Chase Briscoe Breaks Silence on NASCAR’s $100,000 Shutdown appeared first on EssentiallySports.",https://www.essentiallysports.com/nascar-news-unfortunate-chase-briscoe-breaks-silence-on-nascars-hundred-thousand-dollar-shutdown/,,2025-02-22T01:23:30+00:00
signonsandiego,Sabre Springs parents plead not guilty to killing 16-month-old son,Jamar and Helena Branch face a life behind bars in connection to the Nov. 6 death of their 16-month-old son Benjamin.,https://www.sandiegouniontribune.com/2025/02/21/sabre-springs-parents-plead-not-guilty-to-killing-16-month-old-son/,,2025-02-22T01:22:53+00:00
kxlh,Windy and mild for the final weekend of February,It is going to be mild this weekend as highs are going to range from the mid 30s to the mid 50s. We are also going to have widespread gusty to strong winds around this weekend.,https://www.kxlh.com/weather/todays-forecast/windy-and-mild-for-the-final-weekend-of-february,,2025-02-22T01:22:26+00:00
