Source,Title,Description,URL,Published_At
9to5google.com,Pixel 9a leaks in Galaxy S25 Edge leak because why not - 9to5Google,"We’ve had Pixels leak in rideshares and public transit, but the latest pre-release look at the Pixel 9a comes from a Galaxy S25 Edge.",http://9to5google.com/2025/02/22/pixel-9a-real-world-leak/,2025-02-23T00:36:00Z
Nasawatch.com,D.O.G.E. Just Sent You An Ultimatum - NASA Watch,Have a nice weekend.,https://nasawatch.com/personnel-news/d-o-g-e-just-sent-you-an-ultimatum/,2025-02-22T23:21:45Z
Videocardz.com,First GeForce RTX 5070 Ti discovered with reduced ROP count: 88 instead of 96 - VideoCardz.com,"GeForce RTX 5070 Ti with 88 our 96 ROPS found Earlier today, NVIDIA issued a formal statement confirming that the company has shipped GB202 and GB203 GPUs with a defect, which basically lowers the specs of ROPs. The company admitted that this may cause perfor…",https://videocardz.com/newz/first-geforce-rtx-5070-ti-discovered-with-reduced-rop-count-88-instead-of-96,2025-02-22T21:43:00Z
Jalopnik,"3 Things To Know About Dodge's Hurricane Engine, Because Turbos Are Taking Over - Jalopnik",Stellantis' new turbocharged inline-6 is smaller and more powerful than the Hemi V8 it replaces,https://www.jalopnik.com/1797084/dodge-hurricane-engine-guide/,2025-02-22T21:25:08Z
TechCrunch,The fallout from HP’s Humane acquisition - TechCrunch,Welcome back to Week in Review. This week we’re looking at the internal chaos surrounding HP’s $116 million acquisition of AI Pin maker Humane; Mira,https://techcrunch.com/2025/02/22/the-fallout-of-hps-humane-acquisition/,2025-02-22T18:05:00Z
The Verge,"Spotify HiFi was announced four years ago, and it’s almost here — maybe - The Verge",Spotify is finally nearing the launch of a Music Pro add-on that would offer lossless music and other perks.,https://www.theverge.com/spotify/617927/spotify-hifi-music-pro-coming-2025,2025-02-22T17:30:00Z
Android Authority,The OnePlus 13 is proof Samsung is asleep at the wheel - Android Authority,The OnePlus 13 isn't just a great phone. It's one of 2025's best Android phones — and a striking reminder of where Samsung has gone wrong.,https://www.androidauthority.com/oneplus-13-proves-samsung-problem-3528388/,2025-02-22T16:26:45Z
CNET,Amazon Drops New Apple Mac Mini M4 to Lowest Price of 2025 So Far - CNET,The base model Mac Mini M4 desktop is down to $549 with further savings available on bigger storage.,https://www.cnet.com/deals/amazon-drops-new-apple-mac-mini-m4-to-lowest-price-of-2025-so-far/,2025-02-22T15:42:00Z
The Verge,"Asus is making a ‘Fragrance Mouse,’ and it’s coming to the US - The Verge","Asus has announced the Fragrance Mouse, a wireless mouse with a refillable vial inside meant for “aeromatic oils.”",https://www.theverge.com/news/617917/asus-fragrance-mouse-essential-oils-vial-wireless-dongle-bluetooth,2025-02-22T15:08:09Z
Android Central,The iPhone 16e proves we do need Qualcomm for 5G in North America - Android Central,There is a reason it costs less.,https://www.androidcentral.com/phones/the-iphone-16e-proves-we-do-need-qualcomm-for-5g-in-north-america,2025-02-22T13:00:00Z
Wired,Microsoft’s New Majorana 1 Processor Could Transform Quantum Computing - WIRED,"The processor uses qubits that can be measured without error and are resistant to outside interference, which the company says marks a “transformative leap toward practical quantum computing.”",https://www.wired.com/story/microsoft-just-claimed-a-quantum-breakthrough-a-quantum-physicist-explains-what-it-means/,2025-02-22T13:00:00Z
Video Games Chronicle,"More than a dozen NetEase studios are reportedly at risk, including Nagoshi, Quantic Dream and Grasshopper - Video Games Chronicle",The Chinese publisher has reportedly decided to divest from its international studios,https://www.videogameschronicle.com/news/more-than-a-dozen-netease-studios-are-reportedly-at-risk-including-nagoshi-quantic-dream-and-grasshopper/,2025-02-22T12:32:01Z
Wccftech,"Retail Prices For NVIDIA GeForce RTX 5070 Ti Go Crazy: Custom Models Now Listed For $2,000+ - Wccftech","The NVIDIA GeForce RTX 5070 Ti is being listed for over twice the MSRP. Many custom editions are listed at over $2,000.",https://wccftech.com/retail-prices-nvidia-geforce-rtx-5070-ti-go-crazy-custom-models-listed-2000-usd/,2025-02-22T12:11:00Z
HuffPost,Flight Attendants Say These 25 Things Make Travel More Comfortable - HuffPost,"Flight attendants are the MVPs of traveling, so their recommendations are pretty much gold.",https://www.huffpost.com/entry/products-that-make-travel-comfortable_l_67aa6fabe4b038077c881eb4,2025-02-22T10:45:08Z
Videocardz.com,ASUS ROG Astral RTX 5090 catches fire after capacitor blows - VideoCardz.com,"ASUS ROG Astral RTX 5090: For those who dare The new ROG Astral series from ASUS is known for two things: how large these graphics cards are and how expensive they are. The RTX 5090 Astral costs more than $2800, if you are even lucky to find it in stock. Spea…",https://videocardz.com/newz/asus-rog-astral-rtx-5090-catches-fire-after-capacitor-blows,2025-02-22T10:40:00Z
Forbes,iOS 18.4 Release Date: Apple Surprisingly Confirms iPhone Update And New App - Forbes,"Apple has just confirmed when the next big iPhone update will be released, something it rarely does at this point in the cycle.",https://www.forbes.com/sites/davidphelan/2025/02/22/ios-184-release-date-apple-surprisingly-confirms-iphone-update-and-new-app/,2025-02-22T10:00:00Z
Anime News Network,The Pokémon Company Reaches Settlement in IP Infringement Lawsuit in China - Anime News Network,"Guangzhou Maichi Network Technology, Khorgos Fangchi Network Technology issue apology over game app titled Pocket Monster: Remake",https://www.animenewsnetwork.com/news/2025-02-22/the-pokemon-company-reaches-settlement-in-ip-infringement-lawsuit-in-china/.221505,2025-02-22T07:47:49Z
MTG Arena Zone,Magic-Con Chicago 2025 | News Day 1 - MTG Arena Zone,Let's take a look at the first day of Magic Con Chicago 2025 Panel Review!,https://mtgazone.com/magic-con-chicago-2025-news-day-1/,2025-02-22T03:15:41Z
The Wall Street Journal,The Thrill-Seeking Billionaire and SpaceX Astronaut Poised to Run NASA - The Wall Street Journal,,https://www.wsj.com/business/nasa-spacex-trump-musk-isaacman-14c6aebc,2025-02-22T02:00:00Z
pymnts.com,Apple Intelligence to Expand to Vision Pro Headset in April - PYMNTS.com,"Apple said Friday (Feb. 21) that its Apple Intelligence suite of artificial intelligence (AI) features will be added to another platform — Vision Pro, the",https://www.pymnts.com/apple/2025/apple-intelligence-to-expand-to-vision-pro-headset-in-april/,2025-02-22T01:18:50Z
